<!--
    Copyright (c) 2004 International Business Machines Corporation and others. All rights reserved.

    DTD for the ICU deprecated-locales list.
-->

<!ELEMENT deprecatedList ( overrideDraft*, deprecates* ) >
<!ATTLIST deprecatedList version CDATA #FIXED "1.0" >

<!ELEMENT overrideDraft EMPTY >
<!ATTLIST overrideDraft locale NMTOKEN #REQUIRED >

<!ELEMENT deprecates ( alias | aliasLocale )* >
<!ATTLIST deprecates type NMTOKEN #REQUIRED >

<!ELEMENT alias EMPTY >
<!ATTLIST alias from CDATA #REQUIRED >
<!ATTLIST alias to CDATA #REQUIRED >
<!ATTLIST alias xpath CDATA #IMPLIED >

<!ELEMENT aliasLocale EMPTY >
<!ATTLIST aliasLocale locale CDATA #REQUIRED >

